{
  "format": "K/runtime-core/1",
  "runtimeEntrypoint": "src/contracts.mjs",
  "runtimeModules": [
    {
      "locator": "src/contracts.mjs",
      "imports": ["./file-contracts.mjs", "./strict.mjs"]
    },
    {
      "locator": "src/file-contracts.mjs",
      "imports": ["./strict.mjs"]
    },
    {
      "locator": "src/strict.mjs",
      "imports": ["node:crypto"]
    }
  ],
  "runtimeExports": [
    "LIFECYCLE",
    "admitDispatch",
    "advanceLifecycle",
    "appendJournalEntry",
    "assertAcyclicEdges",
    "assertKBindingEdges",
    "canonicalWorkerEnvelope",
    "deriveJournalIndex",
    "endpointRosterRoot",
    "externalDispatchModel",
    "isAdmittedDispatch",
    "isEvidenceJournal",
    "isExclusiveClaim",
    "isJournalEntry",
    "isJournalIndex",
    "isPrivateObservation",
    "isRetainedDescriptor",
    "journalEntryProjection",
    "journalIndexProjection",
    "newLifecycle",
    "openEvidenceJournal",
    "openExclusiveClaim",
    "recordObservation",
    "retainDescriptor",
    "retainedReceipt",
    "validateDispatchPlan",
    "workerEnvelope",
    "workerRowsRoot"
  ],
  "typeModules": ["src/interfaces.d.ts"],
  "buildTimeOnlyLocators": ["generate.mjs", "src/integrity.mjs", "validate.mjs"]
}
